<?xml version="1.0" encoding="UTF-8"?>
<!--Sample XML file generated by XMLSpy v2017 rel. 3 (x64) (http://www.altova.com)-->
<fixs:sessions xmlns:dcterms="http://purl.org/dc/terms/" xmlns:fixs="http://fixprotocol.io/2016/fixsessions" xmlns:xsi="http://www.w3.org/2001/XMLSchema-instance" xsi:schemaLocation="http://fixprotocol.io/2016/fixsessions FixSessions.xsd">
	<fixs:metadata>
		<dcterms:subject>Sample Sessions file</dcterms:subject>
		<dcterms:date>2017-04-05</dcterms:date>
	</fixs:metadata>
	<fixs:session name="XYZ-ABC" someOtherAttribute="thisIsExtensible">
		<!-- there can be any number of identifiers -->
		<fixs:identifier name="SenderCompID">
			<fixs:value>XYZ</fixs:value>
		</fixs:identifier>
		<fixs:identifier name="TargetCompID">
			<fixs:value>ABC</fixs:value>
		</fixs:identifier>
		<fixs:protocol name="FIX.5.0SP2" layer="application"/>
		<fixs:protocol name="FIXT.1.1" layer="session"/>
		<fixs:transport address="10.96.1.2:567"/>
		<fixs:startTime>2017-05-17T09:30:00Z</fixs:startTime>
	</fixs:session>
</fixs:sessions>
